Stop Name,Time,Lat,Lon,W3W
"Leighton Rd, Soulbury",16:15:00,51.930183,-0.713121,///custard.variances.crescendo
"Bus Stop, Caldecotte Lake Dr, Caldecotte",16:35:00,52.005134,-0.697971,///librarian.moss.slot
"Bus Stop, Groveway, Ashland",16:40:00,52.015888,-0.7307,///turns.festivity.worth
"Bus Stop, Buckingham Rd, Bletchley",16:50:00,51.993464,-0.737154,///froth.park.wiser
"Bus Stop, V1 Snelshall St, Kingsmead",17:00:00,52.002951,-0.803518,///solid.marked.diets
"MK Innovation Hub, Silbury Blvd, MK",17:10:00,52.0385,-0.769782,///orange.redeemed.casually
"Bus Stop, H2 Millers Way, MK",17:20:00,52.057501,-0.79625,///alienated.diet.rentals
"Bus Stop, V8 Marlborough St, MK",17:25:00,52.060681,-0.757303,///stumble.organic.verb
"Bus Stop, H6 Childs Way, MK",17:30:00,52.046963,-0.729759,///sank.announced.hype
