Stop Name,Time,Lat,Lon,W3W
"Bus Stop (Opp The Swan PH), Park Rd, Faringdon",15:40:00,51.65563,-1.586483,///mammal.spit.proclaims
"Bus Stop (Seacourt Bridge PH), Westway, Botley",0.673611111,51.751765,-1.298618,///singer.dose.stores
"Bus Stop (Duke of Monmouth PH), Abingdon Rd, Oxford",0.684027778,51.737427,-1.252025,///wider.carbon.shares
"Bus Stop (Slow & Steady PH), Abingdon Rd, Oxford",0.6875,51.744111,-1.256074,///fleet.dime.level
"Bus Stop (All Saints Church Library), High St, Oxford",0.690972222,51.752331,-1.255557,///poems.duty.engine
"Bus Stop (St Josephs Primary School), Headley Way, Oxford",0.697916667,51.76419,-1.226443,///bridge.curvy.ocean
"Bus Stop (Opp Blandford Ave), Woodstock Rd, Oxford",0.704861111,51.785859,-1.278526,///gains.resort.gave
"Bus Stop (Benmead Rd), Banbury Rd, Kidlington",0.715277778,51.824884,-1.292866,///intrigues.romance.able
"Bus Stop (Opp The Broadway), Oxford Rd, Kidlington",0.71875,51.810573,-1.279298,///scorched.slope.silver
